"","title","url","date","news"
"49","Delta Giving Vouchers, 'SkyMiles' as Apology for Flight Troubles","https://www.bloomberg.com/news/articles/2017-04-14/delta-giving-vouchers-skymiles-as-apology-for-flight-troubles","17170","Delta Air Lines Inc. increased the payouts its airport agents can offer passengers on overbooked flights, moving to prevent a public relations nightmare similar to the one plaguing United Continental Holdings Inc., Customer service agents will be able to offer passengers as much as $2,000 when they’re asked to give up a seat on an oversold flight, up from $800, according to a memo seen by Bloomberg. Managers can offer as much as $9,950, more than seven times the previous cap of $1,350, the memo dated April 13 says., The new policies come in the wake of a controversy that enveloped rival United this week, after law enforcement officers dragged a passenger off a United Express flight from Chicago to Louisville, Kentucky. The passenger, David Dao, was already seated on the plane and refused to give up his seat to make room for a United crew member who needed to fly. The incident made worldwide news and led to questions about why the airline didn’t simply offer Dao more money to leave the plane., Delta spokesman Anthony Black confirmed the authenticity of the memo, but declined to comment further. United earlier this week said it would review its policies regarding overbooked flights and announce results of the review by April 30. The company reiterated its plan Friday after the contents of the Delta memo were reported., The memo also gives customer service agents tips on how to best deal with oversold flights, including looking for passengers with other options for non-stop flights. Agents are advised to contact managers if compensation above $2,000 is needed, the memo says. It does not address the United controversy., The airline is changing policy as it deals with its own bad publicity. An April 5 storm in Atlanta shut down Delta’s operations during heavy spring break travel, with delays made worse by a breakdown in the airline’s crew location and assignment systems, Chief Executive Officer Ed Bastian said in an email to customers. About 4,000 flights were canceled in the wake of the storm., Delta is offering hundreds of thousands of customers $200 flight vouchers or 20,000 bonus frequent-flier miles as part of an apology for flight cancellations earlier this month., “I have heard from many of you who feel like we let you down. In acknowledgment of what you endured, 20,000 bonus miles will be added to your SkyMiles account in the next 48 hours,” Bastian said in the emails, which were seen by Bloomberg. “I am sorry for what you experienced.”, The aftereffects of Delta’s storm-related disruptions lasted as many as six days for some travelers, as they struggled to rebook flights or shelved getaways while the airline attempted to recover from the breakdown. Delta said this week that the cancellations, lost revenue and other costs including travel vouchers and bonus mile giveaways will reduce second-quarter pretax profit by $125 million., Some Delta customers who are not SkyMiles members are getting emails offering $200 flight vouchers., As the second-largest U.S. airline, Delta runs about 6,000 flights a day during peak summer months. The airline has more than 800 planes and flies about 180 million passengers a year. , Delta has suffered a series of setbacks in the past year. In January, customers were marooned at airports when flights were grounded due to a computer system breakdown. In August, Delta canceled about 2,000 flights over a three-day period after its worldwide computer system failed., Delta’s Black declined to comment on the voucher and SkyMiles bonus gesture., “As always, any customer who feels the specifics of their flight requires additional attention should contact Delta Customer Care,” he said."
"50","Secrets of Flight Attendants, From Free Upgrades to Mile High Club Fails","https://www.bloomberg.com/news/articles/2017-04-13/secrets-of-flight-attendants-from-free-upgrades-to-mile-high-club-fails","17169","When you cram hundreds of passengers into a carbon fiber tube and shoot it across the sky, things are bound to go wrong. And no matter how dire the state of air travel seems—whether it's the disturbing video caught on a United Airlines flight or Delta's long delays last week—you, the passenger, are privy to only one side of the story., So when Norwegian offered me the opportunity to become a flight attendant last month, I decided to find out what it’s really like to fly the not-so-friendly skies. Here’s everything I learned while serving as a crew member aboard their 787-8 Dreamliner long-haul service from London (LGW) to New York (JFK).*, This may seem obvious given the recent airline news, but yes, flight attendants get free travel perks. And sometimes crew members are paid to fly on repositioning flights that get them to their next shift. They’re called “deadheads,” and they’re the most important passengers in terms of getting a seat on the plane, which is what led to the doctor in Chicago being forcibly removed from his United seat to accommodate one.,  , “Deadheads” is just the beginning. Did you know flight attendants play ping-pong on every flight? That’s what they call beverage service, thanks to the paddle-shaped trays they extend to fill your cup with coffee and tea (to avoid spillage of hot fluids). They also sleep in “crashpads”—shared apartments—when they’re off duty, which are often in “Crew Gardens” (that’s Kew Gardens—a neighborhood near NYC’s JFK airport—to most people). And live out of “Berthas,” or company-issued suitcases., What they surprisingly don’t have a code name for: belligerent customers. But they will refer to problem passengers in “aviation alphabet,” i.e. “21 Golf” for the person sitting in 21G.,  , Flight attendants and pilots never get stuck with the same food you’re eating. They get a completely different set of menu items from the passengers, reducing the risk of food poisoning across the entire airplane. But don’t be jealous. My fellow crew members ate cold platters of sandwiches and chocolate bars. And the customers got surprisingly well-prepared dishes, made in real ovens rather than in microwaves.,  , According to Ilse, another Norwegian crew member, “We all agree that Scandinavians are the best passengers you could ever ask for: So content with being on board, and they don’t ask for much. Passengers traveling from the U.K. and U.S., however, are much more demanding, constantly ringing the bell. They tend to cause a scene and love threatening to sue.” ,  , It’s considered a federal offense to open and imbibe your own liquor on a plane, as the captains on Norwegian will tell you at the start of any flight. So put away the duty-free booze—or anything that’s not served by a crew member: Individual consumption can easily lead to handcuffs when you disembark. (And the crew will be onto you if you order nothing but a glass of ice.), Don’t overdo it with the bar cart nips, either. Flight attendants keep careful tabs on how many drinks each passenger requests, and they reserve the right to refuse you service if you appear too intoxicated. One or two drinks at mealtime is considered standard—but if you’re slurring words, looking glassy-eyed, or making constant trips to the bathroom, the crew is likely watching.,  , After years of flying both in the front and back of the plane, I assumed that working in the premium cabins was a more coveted role: You’re in charge of fewer, more comfortable passengers. I was wrong. Billie Jean and Derek, two of my crew mates, explained that on Dreamliners, most flight attendants prefer the economy service. “Premium passengers aren’t any more or less demanding than economy passengers,"" said Billie Jean, ""and it can be boring manning the galley away from the rest of the crew.”,  , Businessmen, babies, or blissed-out yogis: Which is most likely to annoy a flight attendant? Crew members agree: Yogis take the prize. “It happens at least once a flight, they come into our galley space and start doing stretches, or—even worse—push-ups,” said Ilse. Fellow crew member Grace and Derek agreed and said flights to and from the West Coast carried the greatest number of offenders by far.,  , Yes, it’s true: On transcontinental flights, flight attendants can take naps in a secret dorm room above the galley, through a door that looks like an inconspicuous closet near the lavatories. The berths are like plastic nests with full length-beds, sheets, pillows, and privacy curtains. And breaks are carefully timed: My team was divided into two groups, each getting one hour and 40 minutes of rest in the dorm. To avoid tardiness and miscommunication, the entire cabin crew syncs their analog watches—a wardrobe must—to the time of their destination.,  , Airplane bathrooms are not for the faint of heart. Their stench has even been known to ground long-haul flights., Norwegian’s policy is to clean the lavatories every 20 minutes—and yes, that’s the responsibility of flight attendants. Fun fact: Attendants regularly cover up strong odors by brewing a large pot of coffee and pouring it down the toilet. It neutralizes both the bacteria and the smell.   ,  , “It actually happens far more frequently than you think. I’d say at least once a month someone tries it, with about a 30 percent success rate,” Ilse explained. “We’ve even seen total strangers meet on a flight and make a run for the lavatory together.”, That’s about once every eight flights, if you do the math. As for the failed encounters? Suffice it to say that sprints to the lavatories are usually intercepted. “Sometimes I just want to give the passengers a ton of Purel and say, ‘what are you thinking?’” joked Grace. ,  , Contrary to popular belief, the cabin crew does indeed possess the ability to move you into premium seats. But there probably isn’t space for you., If the front cabin isn’t sold out, initial upgrades go to airline employees first, then family and friends of the staff. , Getting other types of freebies is easier: Just bring a fun snack on board to share with the crew. Think bags of candy. According to my colleagues, edible gifts are considered a kind of inter-airline currency and can be rewarded with free cocktails or other in-flight goodies. (Every flight team has the ability to override the computerized purchasing system.), But if it’s that elusive free upgrade you’re after, you’re just going to have to become a flight attendant yourself. And now that you’ve peeked behind the galley curtain, you’re almost ready to fly. ,  "
"51","Bloomberg’s Ferguson on UAL, Overbooking, and Delta Earnings","https://www.bloomberg.com/news/audio/2017-04-12/bloomberg-s-ferguson-on-ual-overbooking-and-delta-earnings","17168",""
"52","A Simple Way to Ease the Pain of Airline Overbooking","https://www.bloomberg.com/view/articles/2017-04-12/a-simple-way-to-ease-the-pain-of-airline-overbooking","17168",""
"53","United Faces Public-relations Fiasco Over Dragged Passenger","https://www.bloomberg.com/news/articles/2017-04-11/united-faces-public-relations-fiasco-over-dragged-passenger","17167","When it comes to bad public relations, it’s pretty tough to top the sight of a United Airlines passenger being dragged, bloodied and screaming, from a flight., The incident, including two attempts at apology by Chief Executive Officer Oscar Munoz, has been airing on cable TV and raging on social media for days. But the fiasco is hardly the first self-inflicted corporate blunder. Munoz can take comfort that it’s happened to others, and in many cases the bosses didn’t lose their jobs, as our PR Tales From Hell illustrate., QuickTake Can Airlines Really Do That? Bumping and the Law, Over Easter week in 2009, two Domino’s Pizza employees in North Carolina posted a video on YouTube showing one sticking cheese up his nose and pretending to sneeze on a customer’s sandwich. With the clip reaching one million views, management fired the employees, sanitized the store and produced its own video with a formal apology from President Patrick Doyle., The company’s response was to show outrage and take action, said Davia Temin, head of the New York-based crisis-management firm Temin & Co. CEO David Brandon kept his job and now runs Toys “R” Us Inc. Doyle succeeded him., An engine-room fire crippled the Carnival Triumph cruise ship in 2013, leaving 3,100 guests adrift in the Gulf of Mexico without working plumbing. Sewage backed up into the passenger decks, earning the ship the nickname the “Poop Cruise.”, While employees scrambled to the bring the vessel home, Carnival Corp. CEO Micky Arison took in a game of his Miami Heat basketball team. Four months later, Arison gave up the top job. He remains chairman and is still the largest shareholder of the company his father founded., In 2007 TV news cameras caught images of rodents scurrying around a New York KFC-Taco Bell location. Parent Yum Brands Inc. closed the franchised restaurant, labeled it an isolated incident and blamed construction in the basement of the building., Still, sales at other stores fell 11 percent in the first quarter afterward and the company replaced its chief marketing officer., Uber Technologies Inc. CEO Travis Kalanick was forced to apologize and pledged to “grow up” after Bloomberg in February published video of him yelling at a driver in a dispute over the ride-sharing company’s fare policy, the latest in a horrendous three-month run of controversies., Kalanick has promised to hire a chief operating officer to keep him on course, while the company has vowed to outline diversity goals and publish the results of a sexual harassment investigation., On Valentine’s Day 2007, storms left 130,000 JetBlue Airways Corp. passengers stranded, with some travelers stuck on the tarmac for up to 10 hours. CEO David Neeleman apologized profusely but three months later he was out the door, replaced by a new executive described as more of an “operations guy.”, On Tuesday, his newest airline, Brazilian carrier Azul SA, raised $572 million in a U.S. initial public offering and closed up 7.2 percent in its first day of trading. Neeleman used the day’s ceremony at the New York Stock Exchange to defend the industry’s overbooking of flights, the practice United initially said led to the confrontation on its flight this week., United has had more than its share of customer service snafus, including a 2008 incident in which country singer Dave Carroll said the airline damaged his instrument. A song and video he produced about the incident, “United Breaks Guitars,” went viral and has had almost 17 million views., The company later apologized and sought permission to use the video for training. CEO Glenn Tilton remained with the carrier until its merger with Continental was completed in October 2010., Carroll today speaks on customer service. In an interview with the Canadian Broadcasting Corp., he lamented United’s lack of remorse over the current incident., “I would have thought they’d make some advances, but seven years later now, the same sort of problem has emerged,” he said in the interview. “I think it has to do with a culture in the company.”, Representatives of Chicago-based United didn’t respond to a request for comment."
"54","Don't Rush to Judgment on War Crimes","https://www.bloomberg.com/view/articles/2017-04-18/don-t-rush-to-judgment-on-war-crimes","17174",""
"55","Your Evening Briefing","https://www.bloomberg.com/news/articles/2017-04-11/your-evening-briefing-j1dyofii","17167","Want to receive this post in your inbox every afternoon? Sign up here., Good afternoon. Spring is in the air today: Trees are blooming, allergies are emerging, and outrage against United Airlines isn’t even close to subsiding. —Megan Hess, United Airlines’ CEO apologized amid a global uproar after a passenger was forcibly removed from a flight. United initially said the flight was overbooked, and the man whom staff chose didn’t want to get bumped. After the passenger refused to give up his seat, officers dragged him down the aisle as travelers yelled at them to stop. The airline later said it needed room for its own employees to get to another flight. ""No one should ever be mistreated this way,"" United CEO Oscar Munoz said in a statement on Tuesday. He called the event “horrific” and promised a review of policies. The company’s stock tumbled in early trading on Tuesday., Sean Spicer invokes Hitler. The White House press secretary said during a news conference that Adolf Hitler “didn’t even sink to using chemical weapons"" — a comment at odds with Hitler's extermination of Jews during the Holocaust using gas chambers. Spicer was attempting to discuss the horror of the chemical weapons attack last week in Syria that the administration is blaming on President Assad., Trump settled a second lawsuit against a chef who ditched plans for a restaurant in the Trump International Hotel in Washington, D.C. Both Geoffrey Zakarian and celebrity chef Jose Andres, who settled with President Trump last week, canceled their planned restaurants after Trump kicked off his presidential campaign by calling some Mexican immigrants “rapists.” Trump had been seeking about $14 million in damages in the case with Zakarian. Details of the accord weren’t released., Americans only think their taxes are high. The reality is that the average U.S. worker pays quite a bit less than he would elsewhere in the developed world. This has been the case for a long time. According to an analysis of how 35 countries tax wage-earners, the overall tax rate is highest in Belgium (54%) and Germany (49%), while the rate in the U.S. is 32%., Everything you need to know about France’s presidential election. We’re tracking the latest news, polls and indicators showing which way the race is moving — and why. Whether or not you’ve been following closely, this is your update on where things stand, plus a look at the five leading candidates., A former Lone Star Funds exec, who asked judges to weigh the value of “genius” in a bid to win a bigger share of a $225 million fortune than his ex-wife, lost his divorce appeal. Randy Work failed to convince a three-judge panel that his “special contribution” during their marriage meant he was entitled to a bigger share than the typical British practice of awarding a 50-50 division of marital assets., Have your best-ever trip to Europe this summer. As parks spring back to life, inbound summer fares are about to surge through the roof. If you’re still unsure about your summer vacation plans, Bloomberg Pursuits rounded up everything you’ll need to (very quickly) plan your best European jaunt yet, including where to stay, when to go, and destinations you might overlook."
"56","Bloomberg Markets: United Passenger Removal Sparks Outrage","https://www.bloomberg.com/news/audio/2017-04-11/bloomberg-markets-united-passenger-removal-sparks-outrage","17167",""
"57","Your Evening Briefing","https://www.bloomberg.com/news/articles/2017-04-13/your-evening-briefing","17169","The evening briefing will soon be available in your inbox every day. To be among the first to get it, sign up here. , North Korea's nuclear threat is a front-and-center issue for Donald Trump, who says he's leaning on Chinese leader Xi Jinping to put enough pressure on Kim Jong Un to make him back off on his development of nuclear weapons and missiles. Trump sounded hopeful in a press conference, saying: “President Xi wants to do the right thing. I think he wants to help us with North Korea."" A breakthrough on this front looks all the more urgent as satellite imagery showed signs the Punggye-ri nuclear test site northeast of Pyongyang is “primed and ready” to conduct a trial.—Kristine Servando, The curious case of a billion-dollar mine sold for a song. This lithium mine was revalued at least five times amid soaring demand for the wonder metal used inside iPhones to Teslas. Its story begins in the lithium-rich salt pans of Argentina’s Salta Province and stretches all the way to South Korea and Hong Kong, leaving a trail of lawsuits and unhappy investors. , Backlash could hit United CEO where it hurts: his wallet. The airline ties about $500,000 of Oscar Munoz’s annual bonus to customer satisfaction questionnaires that it collects daily. Fliers were already pretty disgruntled, but public fury over the forced removal of a passenger and Munoz's ill-phrased response don't bode well for his pocketbook., ...And here's another airline CEO in the hot seat. Cathay named Rupert Hogg as its new chief, starting May 1. The 55-year-old, who has served as chief operating officer, faces a daunting to-do list after the Hong Kong carrier reported its first shortfall in eight years. Apart from navigating intense competition from China, he’ll also have to contend with Middle Eastern airlines expanding into Asia and a rash of budget upstarts taking customers away with cut-rate fares., Asia's worst-performing currency is back on investors' radar. Sentiment is starting to improve for Malaysia's ringgit, with analysts boosting forecasts and some predicting it may become one of the region's better performers. Global funds fled in November after the central bank acted in an effort to halt the ringgit’s slump., Indonesia can't figure out why it's on the U.S. trade hit list. Officials in Jakarta were left scrambling after the country made it onto a list of nations Trump has ordered investigated for potential trade abuse. Indonesia is seeking to stay out of Trump’s bad books, using a visit by Vice President Mike Pence next week to reassure its commitment to free and fair trade., Filling in the blanc. American drinkers are falling in love with pricier New Zealand wines—at the expense of Australia. New Zealand is reaping the dividends from pushing quality wines, especially sauvignon blanc, at higher prices in a market where consumers are becoming more discerning. Exports to the U.S. have doubled in the past five years, making it the largest market for New Zealand winemakers., A demon of a car. It runs on 100-octane fuel. It can hit 140 mph in 9.6 seconds. Oh, and it also registered the highest G-force of any recorded at the launch of a new production car. World, if you're even ready for it, meet the 2018 Dodge Challenger SRT Demon. The supercharged car is so potent that all customers who buy it receive a full-day session at a school for high-performance driving in Arizona. Naturally, it careens onto Bloomberg Pursuits' list of showstoppers at the 2017 New York Auto Show."
"58","United Is Feeling the Sway of Consumers in Asia","https://www.bloomberg.com/view/articles/2017-04-11/united-is-feeling-the-sway-of-consumers-in-asia","17167",""
