"","title","url","date","news"
"70","Delta Reviewing $14 Billion Wide-Body Deal in Blow to Airbus","https://www.bloomberg.com/news/articles/2017-04-12/delta-reviewing-14-billion-wide-body-jet-deal-in-blow-to-airbus","17168","Airbus SE’s expansion into Boeing Co.’s home market faces a potential setback as Delta Air Lines Inc. reviews a $14 billion purchase of the European planemaker’s two newest wide-body models., The Atlanta-based carrier, known as an influential and shrewd aircraft buyer, is studying its twin-aisle orders amid signs the long-range travel market is saturated, Ed Bastian, Delta’s chief executive officer, said during a quarterly earnings call Wednesday. While he didn’t name Airbus, Delta has no twin-aisle orders pending with Boeing, according to the U.S. company’s online database., “We continue to see excess capacity in wide-bodies as we look to the future for the industry,” Bastian said, adding that Delta, which has orders for the Airbus A350 and A330neo, is in discussions with planemakers. “We continue to look internally as to what that means for Delta. You could anticipate some reductions, I think, broadly over the next several years.”, Word of the review intensifies concerns that demand for long-haul planes is weakening as a long jet-buying binge draws to close. American Airlines Group Inc. last year deferred its A350 order, while United Continental Holdings Inc. said it may swap its A350 purchase for smaller planes., “It definitely contributes to what’s been a building caution, or wall of worry around the wide-body market,” said Ken Herbert, an aerospace analyst at Canaccord Genuity., Airbus shares traded 0.6 percent lower at 71.51 euros as of 9:29 a.m. Thursday in Paris. They closed 0.9 percent higher Wednesday after Bastian’s remarks, paring earlier gains of as much as 1.5 percent. Boeing closed down 1.4 percent to $176.05, the second-biggest slide among the 30 members of the Dow Jones Industrial Average., Airbus confirmed that it is in touch with Delta, while declining to go into detail., “It’s not appropriate for us to comment on our customers’ internal analysis,” spokeswoman Mary Anne Greczyn said by email. “However, as a leading aircraft manufacturer, Airbus continually engages our customers around the world to help optimize their fleet needs.”, The Toulouse, France-based company out-dueled Boeing for Delta’s 50-jet order in 2014 and is slated to begin delivering the first of 25 A350s later this year. They’re intended to replace the Boeing 747 jumbos that once shuttled Delta’s passengers to Asia. The airline has also ordered 25 A330neos, a model that’s yet to fly, as a replacement for its oldest Boeing 767s., The prospect of Delta postponing or canceling the wide-body order adds to uncertainty over Airbus’s efforts to make inroads in the U.S. with its next-generation models., American last year delayed its A350 deliveries by an average 26 months and is due to take the first of 22 planes next year, spokesman Joshua Freed said. The planes were ordered by US Airways Group, which merged with American in 2013. United said last year it was reviewing its purchase of A350-1000s.  , Delta, too, could defer orders to a schedule that better fits its demand forecasts, or shift the mix to other models, according to aviation consultant Scott Hamilton. The carrier may issue a request for proposals for single-aisle aircraft that would pit Boeing’s 737 Max against Airbus’s A321neo and will also need a mid-market planes, such as the lighter-weight regional A330 or the so-called 797 under consideration at Boeing, he said by email., “At face value, the Delta statement might seem alarming,” Hamilton said. “But as so often becomes the case, the ‘review’ may not be what it seems.”, Sales of twin-aisle jets have slowed as the market absorbs a surplus after Boeing and Airbus boosted output at a 16 percent annual pace from 2011 through 2015, said Richard Aboulafia, an aerospace analyst at Teal Group. Late last year, Boeing announced a second cut to the production rate of its 777 jetliner amid a sales drought, while A330neo orders have stalled, he said., In December, Delta scrapped a longstanding order for 18 Boeing 787 Dreamliners that it inherited in its 2008 merger with Northwest Airlines. The airline said then that the decision was consistent with the need “to prudently address our wide-body aircraft needs.”"
"71","Delta Forecasts Pricing-Power Gains After Two-Year Airfare Slump","https://www.bloomberg.com/news/articles/2017-04-12/delta-forecasts-pricing-power-gains-after-two-year-airfare-slump","17168","Delta Air Lines Inc. projected that fares and profits would strengthen this year, giving other carriers a boost as United Continental Holdings Inc.’s customer-service fiasco dominated headlines and social media., Passenger revenue for each seat flown a mile is expected to climb as much as 3 percent in the second quarter, Delta said in a statement Wednesday. That potential end to a two-year slide in the pricing-power gauge helped boost airlines to the biggest advance among industry groupings on the S&P 500 Index., “A lot of people of my ilk were expecting flat, maybe up 1 percent,” said Paul Lambert, an analyst at Tocqueville Asset Management., Delta’s revenue prediction signals that airlines are set to reassert more control over fares after a slide that began with a fare war in 2015. The carrier also sees more favorable trends in ticket demand and is committed to keeping a lid on the supply of seats and flights to boost pricing, Raymond James Financial Inc. analyst Savanthi Syth said in a note Wednesday., The S&P Airlines Index advanced 1.9 percent at 10:37 a.m. in New York, including a 2.4 percent increase for Delta and a 2.3 percent gain for American Airlines Group Inc. United was little changed after declining Tuesday amid public fury that a passenger was dragged out of a plane by security officers after the carrier ordered his removal., Delta’s passenger revenue for each seat flown a mile fell 0.5 percent in the first quarter, behind the airline’s initial forecast from January that the measure, also known as unit revenue, would climb as much as 2 percent. The Atlanta-based carrier had expected a quicker recovery in sales of pricey, last-minute tickets favored by business travelers. Those fares are now “moving in the right direction,” President Glen Hauenstein said on a conference call with analysts., Investors have punished the shares, sending them down 7.9 percent this year through Tuesday compared with a 2.4 percent slide in Bloomberg index of U.S. airlines. The question now is whether Delta can finally hit its unit-revenue forecast “following several high-profile misses,” UBS Group AG analyst Darryl Genovesi said in a note., The underlying pricing and revenue environment looks solid, he said. Two years of fierce competition on some domestic routes has dented pricing power across the industry. A surge in seating capacity across the Pacific and Atlantic also has dragged down fares, with stepped-up competition on lucrative routes to Europe from discount airlines and some Middle Eastern carriers., The first quarter will probably be the worst of the year for Delta in terms of pressure on profit margins from higher fuel prices, said Chief Financial Officer Paul Jacobson., “With an improving revenue profile and further improvement as our cost growth moderates in the second half, we are on track to expand margins for the balance of the year,” he said in the statement., Earnings excluding certain items were 77 cents a share in the first quarter, the carrier said Wednesday, exceeding the average estimate of 75 cents a share based on the average of estimates compiled by Bloomberg. Sales fell to $9.15 billion, compared with analysts’ prediction of $9.14 billion., About 4,000 flight cancellations following storms in Atlanta last week will reduce second-quarter pretax profit by $125 million, the company said. Pretax profit is expected to be $1.76 billion in the current quarter, according to the average of analyst estimates compiled by Bloomberg."
"72","JetBlue Founder Backs Overbooking After United Flight Fiasco","https://www.bloomberg.com/news/articles/2017-04-11/jetblue-founder-backs-overbooking-after-united-removal-fiasco","17167","Overbooking is a necessity for the airline industry, according to Azul SA Chief Executive Officer and JetBlue Airways Corp. founder David Neeleman., United Continental Holdings Inc. is struggling to contain the spiraling fallout over a passenger’s forcible removal from a flight, recordings of which have spread across social media around the world, sparking outrage. They showed officers pulling a passenger from a flight Sunday evening after he refused to give up his seat and then dragging him down the aisle as travelers yelled at them to stop., “There are a lot of no-shows,” Neeleman said at the New York Stock Exchange, shortly after Azul went public. Shares closed up 7.2 percent from their offering price in U.S. trading. “What would hurt the airlines big time is if someone in Congress saw this and wanted to basically make it against the law to overbook flights,"" Neeleman added., Neeleman’s concern isn’t far-fetched. United’s now widely public fiasco has prompted New Jersey Governor Chris Christie and a Democratic Senator from Connecticut to urge the U.S. Department of Transportation to take appropriate action against the practice of overbooking. ""The practice has become unconscionable by United and is abusing passengers coming through Newark Airport and around the nation without cause,"" Christie wrote in his letter addressed to Transportation Secretary Elaine Chao., United Chief Executive Officer Oscar Munoz on Tuesday offered his “deepest apologies for what happened” and said the airline would conduct a review of its procedures and policies to be completed by April 30., Neeleman suggested giving more power to staff at the gates to offer higher compensation to people who volunteer to give up their seats. JetBlue, which Neeleman is no longer a part of, doesn’t overbook passengers."
"73","American Airlines Revenue Measure Signals Pricing Power Recovery","https://www.bloomberg.com/news/articles/2017-04-11/american-airlines-revenue-measure-signals-pricing-power-recovery","17167","American Airlines Group Inc. said a closely watched revenue measure rose more than expected in the first quarter, signaling that a long-awaited recovery in average fares has begun to take hold., Passenger revenue for each seat flown a mile rose as much as 4 percent, up from a previous forecast that the benchmark gauge known as unit revenue would increase as much as 3.5 percent, according to a statement Tuesday. Pretax profit margin excluding one-time items also exceeded a previous forecast and the airline raised its planned growth in flights and seats., The results signaled progress for American in a two-year struggle by U.S. airlines to regain pricing power in the wake of a 2015 fare war. Delta Air Lines Inc. said earlier this month that unit revenue fell in the quarter as the price of last-minute tickets recovered more slowly than expected, and United Continental Holdings Inc. said Monday that the measure would be flat compared with a year ago., American rose 1.5 percent to $42.95 before the start of regular trading in New York., Pretax margin was 4 percent to 6 percent in the first quarter, up from a prior outlook for 3 percent to 5 percent. Costs for each seat flown a mile, a measure of efficiency, rose 8 percent in the quarter, below the carrier’s January forecast of a 9 percent rise., American said the supply of flights and seats would increase 1.5 percent this year, up from a prior plan for 1 percent capacity growth. The airline raised the number as it completes more flights and benefits from an increase in new pilots, which enables more flying by regional jets."
"74","Qantas Stops Selling Tickets in Zimbabwe Due to Cash Shortage","https://www.bloomberg.com/news/articles/2017-04-11/qantas-stops-selling-tickets-in-zimbabwe-due-to-cash-shortage-j1dp2uz7","17167","Qantas Airways Ltd. told travel agents in Zimbabwe to stop selling tickets for its flights after the International Air Transport Association warned it’s getting harder to move funds out of the country, according to a circular sent by the Australian airline to agencies and seen by Bloomberg., The carrier is owed a “substantial” amount by Bank Settlement Plan Zimbabwe, the system that IATA uses to transfer local ticket revenue to airlines, according to the circular from Michi Messner, Qantas’s regional manager for Africa. “We’ve been advised by IATA that the situation with the repatriation of funds out of Zimbabwe is worsening,” she wrote., Messner confirmed by phone from Johannesburg on Tuesday that she had sent the letter, referring further questions to IATA. The industry body wouldn’t immediately comment., The move is an early sign that airlines may be scaling back operations in the southern African country, which is battling a shortage of banknotes that’s forced lenders to cap customer withdrawals and seen retailers offer large discounts for cash payments. Zimbabwe has mainly used the dollar since economic mismanagement and runaway inflation rendered its own currency worthless eight years ago., Cash Is King in Mugabe’s Zimbabwe as Dollar Supply Dries Up, Other international airlines flying into the country include Emirates, Ethiopian Airlines, South African Airways and Kenyan Airlines Ltd., Civil Aviation Authority Zimbabwe is aware of the circular from Qantas, Managing Director Charles Chawota said by phone, adding that the currency shortage is a government issue., International carriers including United Continental Holdings Inc. halted or suspended operations in Nigeria last year after that country’s own shortage of foreign-exchange reserves made it hard to recoup revenue., Zimbabwe travel agents may sell tickets for Qantas flights through a South African partner, according to the airline’s letter."
"75","Your Evening Briefing","https://www.bloomberg.com/news/articles/2017-04-12/your-evening-briefing","17168","The evening briefing will soon be available in your inbox every day. To be among the first to get it, sign up here. , United Continental Holdings Inc.'s CEO has gone from an airline savior to a target of social-media scorn. With a few ill-chosen words after a United passenger was violently dragged off a plane in Chicago, Oscar Munoz stoked the flames of a public-relations firestorm. He struck a more contrite tone almost 24 hours after the incident, but the damage was done. United saw its stock sink and may have risked a blowback from Asian consumers. Ironically, Munoz just last month was named ""Communicator of the Year for 2017"" by PRWeek magazine. —Kristine Servando, Xi Jinping spoke to Donald Trump by phone and pushed for dialogue on resolving the issue of North Korea's nuclear threat. Growing anxiety over war prompted South Korea's government to issue a message of calm to citizens, saying there's no need to worry about security on the Korean Peninsula as the government is working with other nations to manage escalating tensions with North Korea., Australia leads the world in sky-high skyscraper rents. It isn't just housing costs: office rents are becoming dizzyingly high in Melbourne and Sydney, rising faster than in any other global city, according to property consultancy Knight Frank. In Melbourne, where the vacancy rate is at a 10-year low, rents climbed 11 percent. Sydney rents rose 10 percent as some office towers were converted to apartments or marked for demolition to make way for a new train line., China's top man on trade. Zhang Xiangchen, newly named Chinese envoy to the World Trade Organization, is not widely known outside Geneva's trade circles, but he's one to watch closely. Even before taking up the post, Zhang was gently touting the WTO as a potential tool against Donald Trump, a protectionist president who has publicly questioned whether the organization works., Want a less scary tax bill? Chile and New Zealand might prove appealing, as workers there enjoy the lowest tax rates among the world's biggest economies, according to data from the OECD. Those in Belgium might want to consider moving. The average tax rate for a single worker with no children is 54 percent. Check out the list here., Malaysia's longest-serving prime minister has a warning for the nation's current leader, Najib Razak: the end of the ruling party's six-decade reign may be near. A former Najib ally, Mahathir Mohamad, says people are increasingly unhappy with the government, and he predicts an upset in upcoming polls., Manila's iconic jeepneys are in Duterte's crosshairs. The Philippines' most popular and cheapest mode of public transportation is being targeted for the scrap heap as the president tries to modernize the nation and clean up its air by adopting electric vehicles. But drivers of the artwork-laden, smoke-belching vehicles contend they can’t afford the switch, and they staged a nationwide strike in February., Have your best-ever trip to Europe. Here’s everything you’ll need to plan your best European holiday, from staying in a historic Parisian hotel to luxuriating on the best beaches in Greece. Though it may not be in the EU much longer, London makes the list, where, with Brexit roiling the pound, your money will go unusually far.,  "
"76","Delta Delays Drag On, Testing Passengers' Patience","https://www.bloomberg.com/news/articles/2017-04-09/fliers-patience-thins-as-delta-s-recovery-moves-into-fifth-day","17429","Brittany Wengel was supposed to fly Delta to Florida on Thursday for a long weekend away from a gray New York City. As of Sunday, she was still grounded. , Delta, which had canceled her original flight to Fort Lauderdale, rebooked her on another direct one for Sunday morning before canceling that one as well and offering her a multiple layover option instead., “They rebooked me on something today that has three legs,” the 24-year-old marketing professional said on Sunday. “It would take 12 hours of flying just to get to Florida from New York.” With her return flight scheduled only two days later, she decided to forgo the less-than-ideal rebooking and shelve her spring weekend getaway plans altogether., Days after a massive storm struck Atlanta, Delta Air Lines Inc. was still recovering from what airline insiders term an “irregular operation.” The nation’s second-largest carrier has canceled about 3,500 flights since Wednesday, more than the 2,300 canceled during a major computer failure in August that prompted Chief Executive Officer Ed Bastian to apologize to passengers., Delta slid 0.5 percent to $44.96 at 10:11 a.m. in New York. Shares fell 8.2 percent this year through April 7, trailing the 5.2 percent rise in the S&P 500 Index. A spokesman for the airline declined to comment Sunday and couldn’t be reached Monday. , Fueling last week’s meltdown were Delta’s reliance on its Atlanta mega-hub and rules concerning how long flight crews can operate. While much was beyond Delta’s control -- including the surprisingly wicked storm that grounded all Atlanta flights for nearly five hours -- passengers, aviation experts and the airline’s own flight crews wonder if the carrier was slow to anticipate the storm’s severity and react quickly enough when communications started to break down., “I do not want to underestimate the chaos that a five-hour ground stop would cause,” said Bob Edwards, a former chief information officer at United Continental Holdings Inc. who recovered from several storms and computer outages during his tenure there. “Canceling quickly and getting ahead of it and staying ahead of it with cancellations is the key.”, Delta had canceled four flights by 9:34 a.m., compared with Sunday’s 167 cancellations, according to flight tracking site FlightAware.com. The carrier still had 102 delays Monday morning, the website said. Delta said it was “stabilizing” as of Sunday, but that rules mandating pilot and flight attendant rest were creating problems in finding people to fly and staff planes., “We know this is extremely frustrating for our customers and we apologize for that,” the airline said in a statement Sunday. “Delta teams continue to work around the clock to fully reset our operation and keep customers informed.”, Tales of passengers missing weddings and even pilots stuck in remote airports waiting for return trips to Atlanta were all over social media and present a challenge to an airline that prides itself on the best on-time arrival rate among its peers, according to Department of Transportation data. This is the third major cancellation event since summer, though the other two were caused by computer outages., Things were so backed up at Delta’s operations center that on Saturday the carrier urged pilots not to call in, and instead use an automated system called Roll Call for communicating with crew schedulers, an internal communication to pilots showed., Edwards, who left United in 2014, said the majority of Delta’s problems were almost certainly beyond the airline’s control. The Federal Aviation Administration called a ground stop for flights at Atlanta for at least 4 1/2 hours Wednesday, according to tweets from the Hartsfield-Jackson Atlanta International Airport. A halt of an hour or two is more common, Edwards said. An outage of nearly five hours makes things “exponentially worse,” he said., That is long enough that many pilots and flight attendants no doubt ran up against federal regulations on how long they can work before resting. In recent years, things have become so strict that a pilot can be sitting in the cockpit awaiting takeoff and determine that he can’t reach his destination before timing out, Edwards said. He would have to disembark and the airline would have to find another pilot, he said., “There was probably a large number of pilots and crews that timed out, and they timed out in places where there probably were not replacements,” Edwards said., The trick is to get ahead of storms by proactively canceling flights, which prevents airlines from running afoul of flight crew rest rules and helps them reset their networks, he said. The question is whether Delta canceled enough flights at the outset to get ahead of things, he said. That’s especially vital in a hub as big as Atlanta, Edwards said. Sixty percent of Delta’s fleet goes through Atlanta on any given day, the carrier said last week., Delta Chief Operating Officer Gil West on Thursday noted Delta’s surprise at the storm’s severity., “Wednesday’s severe weather was unprecedented for Atlanta and the specific track and intensity of weather like this is often difficult to forecast,” he said in a statement., Another issue: the complex way that crews are paired up nowadays, said Michael Baiada, an aviation consultant and former pilot for United. Pilots, flight attendants and aircraft often come together for only a single flight -- say from Atlanta to New York -- before the pilot may head off on a flight to Chicago, the flight attendants go to Washington and the aircraft is sent to Dallas., That creates huge complexities, with pilots and flight attendants reaching their maximum hours at different times, Baiada said. He prefers the old system of pairing them all up into a team, he said., “It becomes much more complex because you’ve made all these pieces all over the map,” Baiada said., Wengel, the passenger from New York who missed her Florida vacation, said she’s been loyal to Delta because of its reliability in the past. She says she’s rethinking things now based on her experiences this week., “This will probably impact my view of Delta, but we’ll see what their response is as a result of this,” she said. “So far this has been handled so irresponsibly.”"
