"","title","url","date","news"
"32","Global Entry Passengers Swept Up In Trump’s Travel Ban","https://www.bloomberg.com/news/articles/2017-04-21/trump-s-travel-ban-is-frozen-but-the-fallout-isn-t","17198","U.S. Customs and Border Protection revoked the enrollment of people in the Global Entry program and other U.S. “trusted traveler” categories as part of the Trump administration’s travel ban on seven predominantly Muslim nations., The ban triggered raucous protests across the country and was quickly enjoined by the courts. But some industry groups contend the damage to the U.S. travel industry continues., American citizens certified for Global Entry often learned of the issue only when they sought to travel, according to the American-Arab Anti-Discrimination Committee, which says it received “dozens” of complaints and is seeking agency records about the revocations through the Freedom of Information Act., A CBP spokeswoman, Jennifer Gabris, said the agency restored some enrollees by early February after the administration clarified that lawful permanent residents weren’t included in the ban. Last month, federal judges also blocked a revised ban. The CBP did not respond to questions about how many people had been purged and restored to the “trusted traveler” programs., Several of the people who complained about being removed from the programs were U.S. citizens originally from countries not included in the bans: India, Lebanon, and Pakistan, said Abed Ayoub, legal and policy director of the American-Arab Anti-Discrimination Committee, which is based in Washington. And some had their Global Entry status revoked before the bans were announced, he said., Ayoub said he was “fairly certain” the government had revoked the status of members based on their names and wasn’t sure that everyone enrolled in the programs had been restored., “The allegation that U.S. Customs and Border Protection cancelled Trusted Traveler memberships because the member had a ‘Muslim-sounding name’ is completely false,” the agency said. Ayoub’s group filed a lawsuit April 18 in federal court saying that the CBP did not respond to its request for the records., “A lot of these individuals that contacted us are professionals …. they travel often for work and seminars,” Ayoub said. “Nothing changed in their circumstances or in their life to warrant [CBP] to go back and change their eligibility. The only thing that’s changed is the administration and the way CBP does things. What we want to know is ‘Are you focusing on Arab and Muslim-sound names?’ That’s the issue here.”, In its statement, the CBP said it has since restored all affected members of the four entry programs. But on Friday, nine Democratic U.S. senators wrote to Homeland Security Secretary John Kelly seeking information about how many people had been removed from Global Entry and the other programs, how many had been reinstated, and the criteria used for the revocations. The group, which includes U.S. Senator Bernie Sanders of Vermont, requested the information by May 14. Attorneys working for the American Arab Anti-Discrimination Committee are seeking similar information back to November, when the presidential election occurred.,  “Since President Trump took office, members of the Arab and Muslim community have justifiably felt under attack,” the senators wrote, arguing that stripping travelers of their Global Entry status due to religion or ethnicity “likely violates” the Fifth Amendment’s equal protection clause against religious discrimination., To enroll in Global Entry, applicants must pay $100 and provide their fingerprints and other information to the government and complete an interview with the CBP. For those who have their enrollment revoked, the agency refers people to an ombudsman for review., The fallout for U.S. “trusted travelers” from the first travel ban is the latest area in which the president’s immigration and travel policies have had unforeseen consequences on the travel and hospitality industries., “Our reputation around the world is not something we can take for granted,” said Jonathan Grella, executive vice president of public affairs at the U.S. Travel Association. “Our industry is caught in the crossfire as we’re seeking to solve this issue of terrorism.”, The four programs CBP operates to speed entry into the U.S. include Global Entry, for U.S. citizens, lawful permanent residents, and citizens of seven other nations; NEXUS, for travel between the U.S. and Canada; Secure Electronic Network for Travelers Rapid Inspection (SENTRI), for travel between the U.S. and Mexico’s land borders; and Free and Secure Trade (FAST), for “low-risk” commercial shipments between the U.S. and Canada and Mexico. As of Feb. 1, Switzerland was added to Global Entry, bringing the total to nine participating countries., The CBP has several exceptions for eligibility, including criminal convictions, false statements on one’s application, and those who “cannot satisfy CBP of your low-risk status.”, In December 2015, candidate Trump called for “a total and complete shutdown of Muslims entering the U.S.” until the government effectively grasps the security situation. “It’s common sense and we have to do it,” Trump said at a campaign appearance in South Carolina, citing “hatred” of Americans by Muslims. “We have no choice.”, Courts haven’t allowed Trump that choice thus far, but the decision Wednesday by Emirates Airlines to curb its U.S. flying is one sign the message is being heard abroad. The Dubai-based carrier is culling 25 weekly flights from five of its dozen U.S. destinations, citing weaker U.S. travel demand given “recent actions taken by the U.S. government relating to the issuance of entry visas, heightened security vetting, and restrictions on electronic devices in aircraft cabins.”, Homeland Security employees have also increased searches of travelers’ mobile phones and other electronic devices, and prohibited electronics in the cabins of aircraft flying to the U.S. from 10 airports, mainly in the Middle East. Both as a candidate and president, Trump has also focused intensely on Mexico, once calling the nation a source of “bad hombres” and proposing a massive border wall., Trump’s rhetoric and unpopularity abroad is likely to reduce international arrivals by 4.3 million this year, according to market strategy firm Tourism Economics LLC, with more than $18 billion in visitor spending lost by 2019., Christopher Thompson, president and CEO of Brand USA, the U.S. government’s travel-marketing unit, said the industry is currently “dealing with perception versus reality” in terms of what effect Trump is likely to have. A strong U.S. dollar will degrade travel to the U.S. more than any policies, he said., The administration’s rhetoric and policies have created anxiety abroad and are likely to make some travelers reconsider plans to visit the U.S., said Jeff Senior, vice president of marketing at California-based reports operator KSL Resorts and global chair of the Hospitality Sales and Marketing Association Intl., a hotel marketing group., “The very first thing out of anybody’s mouth is sort of a combination of angst and curiosity about how the U.S. is behaving right now,” Senior said. “Nobody wants to travel to a place they don’t feel welcome. There’s some soul-searching taking place. There’s some wonderful destinations around the world—the U.S. isn’t the only place you can visit.”"
"33","Billionaire Birla Said to Eye Booming Global Carbon Fiber Market","https://www.bloomberg.com/news/articles/2017-04-20/billionaire-birla-said-to-eye-booming-global-carbon-fiber-market","NA","Indian billionaire Kumar Mangalam Birla is exploring entry into the production of carbon fiber, a high-strength and light-weight composite material expected to be a $4.7 billion global business by 2022, according to a person familiar with his thinking., The Aditya Birla Group, the $40 billion mining-to-mobile phone carrier conglomerate, may buy the technology to manufacture carbon fiber at one of its existing overseas manufacturing facilities, said the person, asking not to be identified because the plan is private. Another option is to buy a carbon fiber plant from another company if the technology is too complex to be adapted at Birla plants, the person said., Carbon fiber is finding increasing traction among defense manufacturers and automobiles makers that seek strong, high-tensile, heat-resistant and light materials. The market for carbon fiber -- dubbed the ‘wonder material’ by The Guardian newspaper last month -- is estimated to more than double to about $4.7 billion by 2022 from $2.2 billion in 2015, according to an Allied Market Research report., “The main positive is that it’s a much lighter material versus competitors such as steel or aluminium -- but is just as strong,” said Johnson Imode, a London-based analyst with Bloomberg Intelligence. “This makes for energy and efficiency savings for customers.”, The group’s consideration is still at an exploratory stage and there’s no timeline for entering this business, the person said. The demand from the automobile sector is particularly high as designers aim to make cars both lighter, stronger and less polluting, according to this person. The group doesn’t comment on “speculative stories,” spokeswoman Pragnya Ram said in an email response., Carbon fiber is a thin long strand, far thinner than even a human hair, in which carbon atoms are bonded together in a crystal alignment that makes the fiber incredibly strong for its size. Thousands of these strands are entwined together to form a yarn, which can be then woven into a fabric or used as it is., The applications for the material range from aircraft and spacecrafts to racing cars, sailboat masts, wind turbines and even golf clubs. The market could grow as much as 10 percent annually, Imode estimates., Nearly half of the airframe of the Boeing 787 Dreamliner is comprised of carbon fiber reinforced plastic and other composites, according to the airline manufacturer., Japan, U.S. and Europe are home to the bulk of the world’s carbon fiber manufacturers, making it one of the likely corporate hunting grounds for Birla to scout for a target. The biggest players include Toray Industries Inc., Hexcel Corporation, Mitsubishi Rayon Co., Teijin Ltd., SGL Group, Cytec Industries Inc., Nippon Graphite Fiber Corp. and Zoltek Companies, Inc., The conglomerate, if it takes the plunge, would be the first large Indian player in the carbon fiber market., Birla, 49, known for his penchant for dealmaking, has sealed two dozen mergers and acquisitions in the past two decades., He’s in the process of combining his mobile-phone unit Idea Cellular Ltd. with Vodafone Group Plc’s Indian business to form the nation’s largest wireless carrier. UltraTech Cement Ltd. had bought cement units from debt-laden Jaiprakash Associates Ltd. last year. This month he received a nod from shareholders to merge two listed group firms, Aditya Birla Nuvo Ltd. and Grasim Industries Ltd., to create a behemoth with $9 billion in combined revenues."
"34","U.S. Airlines Get a Break as Emirates Trims Flights After Trump’s Bans","https://www.bloomberg.com/news/articles/2017-04-19/emirates-cuts-u-s-flights-as-trump-s-bans-hobble-travel-demand","17175","U.S. airlines stand to benefit from flight cutbacks by Dubai-based Emirates, which blamed President Donald Trump’s travel restrictions for hurting demand from Middle Eastern passengers., Emirates will pare service to five U.S. cities after the country banned on-board electronics on flights from some Middle Eastern airports and attempted to block travel from six predominantly Muslim nations. That trims competition from the biggest Persian Gulf carrier -- a persistent irritant to long-haul U.S. operators that see it as an unfair rival., With fewer flights, some Emirates passengers may switch to big European airlines and their U.S. partners for travel from the Middle East and Asia. American Airlines Group Inc., Delta Air Lines Inc. and United Continental Holdings Inc. have prodded U.S. officials for two years to act on their complaints that $50 billion in government support has enabled Emirates, Etihad Airways PJSC and Qatar Airways Ltd. to compete unfairly., “Any reduction in capacity from them is only a good thing for U.S. airlines,” said Joe DeNardi, an analyst at Stifel Financial Corp., Etihad said demand remained strong for flights to the U.S. and pledged to upgrade New York service by using Airbus SE A380 super jumbo jets. Qatar Airways, which also serves airports affected by the laptop ban, didn’t immediately comment on its own capacity in the U.S., “I understand the problem and I agree as a business traveler, that’s my most productive travel and now I’m looking to book through Europe,” said Michael Weiss, an Atlanta businessman who frequently travels to the Middle East and has preferred the customer service on Qatar Airways. “Fellow peers are doing the same thing because we need to be able to work.”, A Bloomberg index of U.S. airlines advanced 1.4 percent at the close in New York, the biggest gain in three weeks., American declined to comment. United and Delta referred questions to the Partnership for Open & Fair Skies, which represents the carriers and several airline unions. In a statement Wednesday, that group said the Persian Gulf carriers were “propped up by billions of dollars in government cash” and as a result have never considered market demand in deciding where to fly., Emirates’ service to Seattle, Boston and Los Angeles will drop to one a day from two, while Fort Lauderdale and Orlando will get five flights a week, compared with daily services now. The changes will be phased in starting on May 1, the airline said in a statement Wednesday., “The recent actions taken by the U.S. government relating to the issuance of entry visas, heightened security vetting and restrictions on electronic devices in aircraft cabins, have had a direct impact on consumer interest and demand for air travel into the U.S.,” Emirates said. “Over the past three months, we have seen a significant deterioration in the booking profiles on all our U.S. routes, across all travel segments.”, Emirates will redeploy some U.S. capacity to serve routes across its global network. The carrier’s Dubai hub was one of the 10 airports affected by a ban on electronics in carry-on luggage on U.S.-bound flights. Trump’s order restricting visitors from six countries -- Iran, Libya, Somalia, Sudan, Syria and Yemen -- has been blocked in court., Emirates, which serves 12 U.S. cities as part of its network of more than 150 destinations worldwide, will “closely monitor” the situation with the “view to reinstate and grow” its U.S. operations as soon as viable, it said., Emirates, Etihad and Qatar Airways have grabbed a substantial portion of the lucrative market for travel from the Americas and Europe to the Middle East, Asia, Africa and Australia by developing their home bases into huge transfer hubs. If travelers look to European carriers to get to the Middle East or India, U.S. carriers could benefit through revenue-sharing agreements with partner airlines., “If Emirates slashes their presence to Seattle in half, that’s a few hundred seats a week,” said Peter van der Lende, a former Delta executive who worked on global alliances. “That traffic would have gone to Dubai and beyond. Some of that traffic needs to find other solutions. The one that’s on top of the list to receive that traffic is Delta,” which has a Seattle hub., Some of the flights Emirates is cutting may not have been very profitable, van der Lende said. Florida cities often attract more leisure travelers than lucrative business fliers. Boston doesn’t work as well as other Emirates destinations such as Dallas for flight connections to other U.S. cities., “I think they were hurt by both bans, but most likely those routes were marginally profitable, if at all,” said van der Lende, who’s now a business development consultant in Atlanta with Expand360."
"35","We’re Now the Friendly Skies, Emirates Tells a Red-Faced United","https://www.bloomberg.com/news/articles/2017-04-12/we-re-now-the-friendly-skies-emirates-tells-a-red-faced-united","17168","Middle Eastern carriers seized on the social media storm surrounding the forced removal of a passenger from a United Airlines flight to mock one of the arch-critics of their breakneck expansion., Dubai-based Emirates lampooned United’s motto on its Twitter account, urging passengers to “fly the friendly skies with a real airline,” while Qatar Airways tweeted an image of its own app, which it said “doesn’t support drag and drop.” Royal Jordanian Airlines joked that it’s also against dragging in an anti-smoking advertisement, while Turkish Airlines pointed out that it last week added an extra passenger to one of its flights after a baby was born on board. , While most airlines steered clear of commenting on the United debacle, the U.S. giant’s embarrassment over the removal of the man to make way for one of its employees was too good an opportunity to miss for Mideast operators subject to years of gibes over the part played by state funding in their success story., The Emirates tweet includes a video mocking United Chief Executive Officer Oscar Munoz’s suggestion this year that Gulf carriers “aren’t real airlines” by highlighting its Tripadvisor ranking as the world’s best carrier in 2017. The post ends with the punchline: “Fly the friendly skies... this time for real.”, The world’s biggest long-haul airline has taken a swipe at U.S. rivals before, most notably in a 2015 ad campaign that showed Jennifer Aniston being offered peanuts and a hand towel by American-accented flight attendants, before waking to find herself cosseted in the flat-bed seat of an Emirates superjumbo., Royal Jordanian’s anti-United tweet shows a picture of a no-smoking sign on one of its aircraft along with the message: “We would like to remind you that drags on our flights are strictly prohibited by passengers -- and crew.”, Turkish Air re-tweeted a message from Huffington Post founder Arianna Huffington commenting: “Instead of involuntarily removing a passenger, Turkish Air assists in involuntarily adding one.” That’s after a girl was born last Friday on the carrier’s flight between Guinea and Burkina Faso., Qatar Air accompanied its drag-and-drop pun with the blurb: ""We’re united in our goal to always accommodate our passengers, even with our app updates.”, United Continental Holdings Inc., Delta Air Lines Inc. and American Airlines Group have accused Emirates, Etihad Airways PJSC and Qatar of competing unfairly in global markets with the help of more than $40 billion in illegal government subsidies, something the Gulf carriers deny., The U.S. operators recently urged President Donald Trump to curb flying rights for their rivals. Tensions have ratcheted up further with an attempted ban on citizens of six Muslim-majority countries entering America, together with a bar on passengers carrying large electronic devices aboard U.S.-bound flights from airports in the Middle East and North Africa, including the bases of Emirates, Turkish Air, Qatar Air and Royal Jordanian., United’s Munoz on Tuesday issued a second apology for Sunday’s incident in Chicago, in which the ejected passenger, David Dao, was left bloodied and dazed, saying that “no one should ever be mistreated this way,” and promising a review of his airline’s procedures to be completed by April 30., The CEO had earlier apologized only for having to re-accommodate customers, labeling Dao, who received hospital treatment, “disruptive” and “belligerent.”"
"36","American Airlines Pilots Say Uniforms Are Making Them Ill Too","https://www.bloomberg.com/news/articles/2017-04-19/american-airlines-pilots-say-uniforms-are-making-them-ill-too","17175","American Airlines pilots will be surveyed about reactions to the carrier’s new uniforms after about 100 reported rashes, itching and other symptoms similar to those experienced by hundreds of flight attendants., Some aviators said recently they had red, swollen eyes and a general ill feeling even though they had been wearing the new clothing since September, according to Dennis Tajer, an Allied Pilots Association spokesman. The union plans to ask members later this week for feedback on reactions and advise them on what steps to take in response, he said Wednesday., “They have to be fit for duty,” Tajer said in an interview. “If the uniform is making them not fit for duty, then something has to change.”, American distributed 1.5 million pieces to 70,000 employees in its first major uniform change in 30 years. The airline has declined to recall the clothing. , The Association of Professional Flight Attendants has said more than 3,000 of its members have filed complaints since receiving the uniforms. American sets the count among all employees at about 800, including four pilots., “Whatever they find in their survey, we’re happy to meet and discuss it with them,” said Ron Defeo, a spokesman for American Airlines Group Inc. “We’ve shown we’re willing to work and find solutions. We’d do the same with pilots.”, Twin Hill, a unit of Tailored Brands Inc., supplied the new uniforms and has worked with the airline and the flight attendants’ union on testing since employees began reporting reactions. So far, nothing has been found to cause the problems., Read more: The mystery of American’s ailing flight attendants, American offered employees several options to replace uniform pieces, including an alternate supplier for flight attendants and customer-service agents. Pilots have been given non-wool and cotton versions from Twin Hill, and the airline is working to secure another option, Defeo said. Employees also are being allowed to wear old uniforms., A couple of pilots became ill enough that they couldn’t fly, Tajer said, and others discovered they had symptoms only while wearing the uniforms. , “We don’t know what we’re going to find out,” he said. “It’s certainly not the same numbers as the flight attendants, but there is some real concern that there’s a bigger problem out there.”, A representative for Tailored Brands didn’t immediately respond to a request for comment., The pilot cases were reported Tuesday by the Chicago Business Journal."
"37","United Changes Crew-Booking Policy After Passenger's Removal","https://www.bloomberg.com/news/articles/2017-04-15/united-modifies-policy-for-booking-crew-on-crowded-flights","17171","United Continental Holdings Inc. has changed its policy on employee travel and will now ensure crews riding on its aircraft as passengers are booked at least 60 minutes before departure, according to a statement from the company., The change, issued Friday, came after the backlash created by a video showing a United passenger being pulled from his seat and dragged down the aisle after refusing to leave an April 9 flight to make room for an airline employee., The passenger, David Dao, suffered a concussion, a broken nose and two lost teeth, according to one of his lawyers on Thursday. Attorney Thomas Demetrio said that Dao will “probably” sue., A hearing scheduled Monday was canceled after United and the city of Chicago agreed to Dao’s request to preserve and protect evidence, Demetrio’s office said Saturday. A filing last week asked a judge to require the airline and city to preserve surveillance videos, crew lists and other information., United crews previously could be booked on flights until the time of departure. The change will allow employees to bump passengers, if necessary, in the gate area to avoid what happened on Dao’s flight: forcing passengers to leave their seats after they already boarded the airplane, said Maggie Schmerin, a United spokeswoman., “This ensures situations like Flight 3411 never happen again,” she said., Bumping passengers is permitted by the U.S. Department of Transportation as long as airlines provide some compensation -- typically a voucher for future purchase -- and a seat on a later flight. If there aren’t enough volunteers, airlines can pick passengers -- on United, those who paid more for a ticket or fly frequently are less likely to be selected., Can Airlines Really Do That? Bumping and the Law, United initially said that Dao’s flight, from Chicago’s O’Hare International Airport to Louisville, Kentucky, was overbooked, and its staff picked passengers to be bumped. But the airline later said it needed to make room for its own employees to keep other flights on schedule., United is reacting to pressure from the public-relations fiasco that blew up after the video spread on social media. Chief Executive Officer Oscar Munoz initially called Dao “disruptive” and “belligerent” and apologized only for the need to “re-accommodate” him, but later struck a more contrite tone in a nationally televised interview., Competing airlines are taking note of the controversy and making changes of their own. Delta Air Lines Inc. increased the payouts its airport agents can offer passengers on overbooked flights to $2,000 from $800, according to a memo seen by Bloomberg., While United is modifying its policy when it comes to booking its own crew, it didn’t say if the policy of overbooking flights will be changed. The company said it is conducting a full review, and it will announce the results by April 30."
